name,address,rating,total_ratings,reviews
Henry's Pub Helsinki,"Mikonkatu 15, 00100 Helsinki, Finland",4.1,1788,"[{'author': 'Happy Tourist', 'rating': 5, 'text': 'I was searching for a good pub that serves chicken wings, and this came up as the best option of a few places.\nWent for it and was well pleased with food and reasonably priced drinks.\nThose visiting Helsinki should visit this place. Can get busy tho.', 'time': '5 months ago'}, {'author': 'Lorraine King', 'rating': 5, 'text': 'Great pub for a few pints and some bar food.\nWe had the pork schnitzel with waffle fries and the breaded chicken, and both were very tasty with nice dips as accompaniment.\nPrice seemed to be standard for Helsinki...€35 - 40 for both meals and €22 for 2 pints.\nGreat atmosphere, great music, pool table, and arcade game available, too.\nWe came back a second time as we enjoyed it so much!', 'time': '8 months ago'}, {'author': 'Angus Stewart', 'rating': 5, 'text': 'Friendly helpful staff, good choice of drinks and great burgers and wings. I went every day of my break there 👍', 'time': '6 months ago'}, {'author': 'amon zoran', 'rating': 5, 'text': 'Fast service, tasty food, and excellent choice of music, will visit again! The kitchen works at midnight!', 'time': '2 months ago'}, {'author': 'Oskari Rekola', 'rating': 3, 'text': 'Wings had gone too dry, prices up. Decent burger, fries lacked spirit, and salt. Beer + pub grub = 30€/pax. So you get less with more. Service was varying - out waiter was very much on point while the bar staff was frosty experience.', 'time': '3 months ago'}]"
Beer Restaurant Villi Wäinö,"Kalevankatu 4, 00100 Helsinki, Finland",4.1,1106,"[{'author': 'Dmitrii Kretinin', 'rating': 5, 'text': 'The cool pub. I got a lot of emotions. I tried new beers. Very good personal. Beautiful people.', 'time': 'in the last week'}, {'author': 'Orsini Sambo', 'rating': 5, 'text': 'Relaxed place for an after work drink, a get together with your pals, spouse, date or business partners, to discuss, flirt, celebrate or even just to have a drink on a very bad day.\nI might make it a Most everytime I come to Helsinki', 'time': '6 months ago'}, {'author': 'Esa Jalonen', 'rating': 5, 'text': 'Quite ok sauna. We spent a good time in the sauna of villi Wäinö. Nice service and friendly staff. After sauna we took couple of beers in a bar. Good selection of fine beers... Nice atmosphere🍺', 'time': '6 months ago'}, {'author': 'Domna Tzemi', 'rating': 4, 'text': 'Nice bar and spacious. Suitable for a big group. The staff were friendly and nice. Prices are good, at least for the house wine. I visited this bar during the week and it was quite busy, but not packed. I would like to go back some time.', 'time': '2 years ago'}, {'author': 'RE M', 'rating': 5, 'text': 'The place to go if you need a beer after midnight. Large variety of beers makes it really an olut-ravintola. Music is not as dark&heavy as across the street but more mainstream and very good along the beer. Toilets clean & good.\nKippis!', 'time': 'a year ago'}]"
Liberty or Death,"Erottajankatu 5, 00130 Helsinki, Finland",4.5,872,"[{'author': 'Joel Pagett', 'rating': 5, 'text': 'Liberty or Death is a great spot for a cocktail whilst in Helsinki. The bar is dark and moody, with a great selection of cocktails and spirits, all carefully made by their bar team.\n\nI sampled several of the cocktails whilst in Liberty or Death and found them all expertly made and served well. The staff were friendly and welcoming, and I found the whole experience very good. If you’re looking for great cocktails in Helsinki - you won’t go wrong with Liberty or Death.', 'time': 'a month ago'}, {'author': 'Sinan Akgul', 'rating': 4, 'text': 'Nice seating area outside and good service but the cocktails are very expensive and not many options in the menu. Of course they prepare classics.', 'time': 'a month ago'}, {'author': 'Nic Kalli', 'rating': 1, 'text': ""If you're a tourist avoid this place they steal your money. They have secret prices  and they ask almost double prices I pay for 3 jins with tonic and some olives 103 € . When I ask what is all this they say to me that they made special shots 3ple doses and excuses of the middle age. Stay away."", 'time': '2 months ago'}, {'author': 'Evan S', 'rating': 5, 'text': 'Would give this place 6 stars if I could! Finally found a great cocktail bar (which I had been struggling to find during our trip around Scandinavia)\n\nSat at the bar, and the bartender was amazing! She recommended a number of twists on drinks I like, and was super knowledgeable. I always love learning new things at a bar, and this place definitely delivered!\n\nHighly recommend!! (Also don’t drop the menu on your foot, you’ll see what I mean).', 'time': '2 years ago'}, {'author': 'AJ F', 'rating': 3, 'text': 'The cocktails were OK,not a bad spot for a quick cocktail.Service is pretty good.', 'time': '6 months ago'}]"
Bar Loose,"Annankatu 21, 00100 Helsinki, Finland",4.0,1227,"[{'author': 'Yacky Lau', 'rating': 5, 'text': ""Very good underground performance venue. The sound system is great, the DJ is great too, and the venue is large enough.  The bands is very good, I like heavy metal, death metal, black metal, it's very great. I spent a pleasant Friday night here. I love Helsinki, an important reason is because of these music"", 'time': '4 months ago'}, {'author': 'Tony Gray', 'rating': 4, 'text': 'Hard rock being play and lots of music memorabilia on the walls.\nDefo a place if you like your music hard.\nFriendly staff and nice beer.', 'time': '3 months ago'}, {'author': 'Neoprophet 13', 'rating': 5, 'text': 'Cosy place in downtown Helsinki. Good selection of beers, rock music and great decor. Staff very friendly.', 'time': '7 months ago'}, {'author': 'A V', 'rating': 5, 'text': 'Great place.  Cheap beers, good music and ambience.', 'time': '2 months ago'}, {'author': 'Elizabeth Toney', 'rating': 4, 'text': ""We went rather early so it was quite empty. Happy hour prices, 3.50 specials. Really nice environment, lots to look at. The bathroom grafiitti reminded me of metal bars back in the US. We didn't stay for the music downstairs, maybe next time."", 'time': '2 years ago'}]"
Base Bar,"Kalevankatu 3, 00100 Helsinki, Finland",4.4,574,"[{'author': 'Eric de Jong', 'rating': 5, 'text': 'We walked in and as soon as the sweet melodies of Machine Head penetrated our ears, we knew we would get drunk. The bartender with the nosering loved shots and threatened us with an axe if we didn’t take enough shots. Loved it. What a hero. We enjoyed metal, beers and shots all night. Threw up at the AirBnB when we came back. The next morning, the owner thanked us for “being so clean”. Epic. Then we flew back to the Netherlands. 100% recommend! 🙌🏼', 'time': '3 weeks ago'}, {'author': 'Casey Dent', 'rating': 5, 'text': 'Nice heavy metal bar in Helsinki. They played Meshuggah while I was there \\m/', 'time': 'a week ago'}, {'author': 'Pavel Bodiš', 'rating': 5, 'text': 'Nice bar with specifics atmosphere. They serve various beers 🍺 and drink. We had draft Cider. For 3€ they offer 🥜 peanuts or small pack of chips. The staff was very nice! Recommend visiting.', 'time': '2 years ago'}, {'author': 'Sean Young', 'rating': 4, 'text': 'Decent bar. Music OK. Sm9k8ng deck cool. More Finnish and swedish metal please.', 'time': '2 months ago'}, {'author': 'Katri Carneiro', 'rating': 3, 'text': ""A metal bar in the center of Helsinki. A bit pricey, beers are 7-10 euros. I understand it's maybe because of the location and their rent but the cramped interior combined to the prices does not make it a first choice."", 'time': '6 months ago'}]"
Molly Malone's Irish Bar,"Kaisaniemenkatu 1, 00100 Helsinki, Finland",4.0,2587,"[{'author': 'Anna Hietanen', 'rating': 4, 'text': 'Probably the most authentic Irish Pub in Helsinki with live music. They also have a lovely terrace in the back. Too bad that at the time it was too cold to sit there (but that\'s finnish summer for you).\n\nCame here to have a pint of Guinness as a ""dessert"" and was surprised by the extremely nice bar maid asking me if ""I wanted a picture on it"". I said sure and ended up with a randomly selected picture of the Dalai Lama wearing a flower wreath on it. It was so much fun, me and my friend had to order a second round. That time it was a panda and a lighthouse. I know it is a gimic, but like my friend said she would have never ordered a Guinness in the first place if it wasn\'t for the picture, so great job getting people hooked on Guinness! Will definitely come back just to show my other friends!', 'time': '3 months ago'}, {'author': 'Posa Bogdan', 'rating': 5, 'text': ""One of the best places in Helsinki.\n\nLive music, good beer lovely vibe.\n\nDon't believe me, come and see for yourself."", 'time': '6 months ago'}, {'author': 'Dimitris Greece', 'rating': 4, 'text': 'Lively Irish pub in the heart of Helsinki downtown. Friendly staff, wide variety of beers and very good guest artist with a live programme!', 'time': '4 months ago'}, {'author': 'Shawn Field', 'rating': 4, 'text': ""First time at this Irish bar in Helsinki. And it is exactly what a lively Irish pub should be and feel like on a Friday night! The second floor has a band stage and a bit of a dance floor. The space is perfectly sized for the acoustics. And for the love of good music, I couldn't tell you the Swedish 3-piece band that played last night, Fri Nov. 3, '23. But I believe they are here for a week of playing."", 'time': '10 months ago'}, {'author': 'R', 'rating': 5, 'text': 'Cozy bar with great atmosphere, good live music & awesome Guinness custom photo decor option🥰', 'time': '2 months ago'}]"
Kitty's Public House,"Mannerheimintie 5, 00100 Helsinki, Finland",4.2,1306,"[{'author': 'Domna Tzemi', 'rating': 4, 'text': 'Nice and quiet bar with comfy booths. I visited this place on a Saturday night and it was not too busy. The music is not too loud, therefore making conversations easier compared to loud bars. The staff were friendly enough.', 'time': 'a year ago'}, {'author': 'Matthew Herridge', 'rating': 5, 'text': 'Very cool place. Dark and underground. Lots of excellent beers on tap', 'time': '5 months ago'}, {'author': 'Mr T', 'rating': 4, 'text': 'Very nice and cozy place. Beautiful interior and a good selection of ales, beers and non alcoholic beverages. Can highly recommend.', 'time': 'a year ago'}, {'author': 'Alison Austin', 'rating': 3, 'text': 'We had wings and nachos.  The wings were crispy and the hot sauce was flavorful. The nachos were a bit of a disappointment.  They needed more of everything as you end up eating a lot of dry chips in the end.  Great atmosphere and good beer.', 'time': 'a year ago'}, {'author': 'David Godwin', 'rating': 5, 'text': 'Great British style pup! Minimal food, but great drinks in a laid back atmosphere', 'time': 'a month ago'}]"
Brewster Bar KALLIO,"Kaarlenkatu 1, 00530 Helsinki, Finland",4.1,780,"[{'author': 'Alan Dovnod', 'rating': 4, 'text': ""Nice little bar with a warm atmosphere and good music. Good price for regular beer, but quite expensive for anything else. They had Laguntias ipa on draught which tasted amazing, but at €9.80 a glass that's a star lost. Still one of the best bars in the area."", 'time': '5 months ago'}, {'author': 'Ivonne R.', 'rating': 4, 'text': ""Yeah, it's fine and fun. Good beer, good music (we were listening to Rush! ) and you can have a conversation because they don't have the volume very high. We had fun"", 'time': '6 months ago'}, {'author': 'Irene Laitinen', 'rating': 4, 'text': 'A very nice place to go have a drink or two with friends. Music was not too loud and you can actually have conversations here. Very cheap drinks as well. Overall a great place, I highly recommend it!', 'time': 'a month ago'}, {'author': 'Domna Tzemi', 'rating': 4, 'text': 'Very nice bar in Kallio. I visited this bar on a Saturday evening and it was quite busy. The music is not too loud so youncan have a pleasant chat with your friends. The staff were very friendly and nice. It is popular mostly to younger people. Prices are good, cheaper than the bars in town. The bar itself is nice and cosy. I will definitely go back again and again.', 'time': '2 years ago'}, {'author': 'Dominic Parkinson', 'rating': 5, 'text': ""Great bar, fantastic prices, asked the bar staff for an old fashioned cocktail. They said it wasn't on the menu. But on the spot, they made up a lovely old fashioned for me. Please give these guys a try."", 'time': 'a year ago'}]"
Restaurant Juova Hanahuone,"Kaisaniemenkatu 3 b, 00100 Helsinki, Finland",4.5,387,"[{'author': 'Gavin Scarman', 'rating': 5, 'text': 'I have no idea why you would drink beer anywhere else in Helsinki. The food is pretty cheap, filling, tasty, and the beer selection is excellent. The best thing that could happen to Finland is one of these pubs in all the ""ghost towns"" we drove through.', 'time': 'a week ago'}, {'author': 'Nicolaus Steiert', 'rating': 5, 'text': ""UMATCHED selection of Brewskies!\nThis place is SO FREAKIN KÜHL! There's so many dang beers that you're never going to get bored! The flavor-galaxy is enormous here!\nLots of local Finnish craft beers on Tap. I was surprised to find so many American Beers too! Evil Twin, Sierra Nevada, etc. The bottle selection was like a dream come true  for me since our selection is so lacking back home in the States😭😭😭\nStaff is Super Chill and the Vibes are the Definition of GAS! THANKS A BUNCH!\n-Nico"", 'time': 'in the last week'}, {'author': 'Stephen Gibson', 'rating': 5, 'text': 'Stopped in for a NEIPA. Was not disappointed, excellent range of NEIPA’s and was able to try before buying.', 'time': 'a week ago'}, {'author': 'Matthew Klein', 'rating': 5, 'text': 'This place has an excellent selection of European craft beers. I had the quesadilla and it tasted quite good. The bar tenders were friendly and helpful in choosing beers.', 'time': '4 months ago'}, {'author': 'Ryosuke Yunoki', 'rating': 5, 'text': 'I had the best Hot Dog 🌭 and craft beers experience🍺 EVER!!', 'time': '4 months ago'}]"
The Riff,"Iso Roobertinkatu 3, 00120 Helsinki, Finland",4.5,1301,"[{'author': 'Albert Vsc', 'rating': 4, 'text': 'Nice bar where you can drink a good beer and listen rock/heavy metal music. It is located in the city center of Helsinki and there is a wide range of beers and drinks. On the walls there are some guitars and paintings of famous musicians like Slash and the famous Finnish heavy metal band Nightwish. The staff is young and friendly. A must visit if you are a fan of heavy metal music.', 'time': '6 months ago'}, {'author': 'vlospa kasbe', 'rating': 5, 'text': 'Excellent! Super fast and friendly service, fine selection of beers and shots, a very nicely decorated place and the pure metal music makes the atmosphere there ideal to enjoy a metal night.', 'time': '4 months ago'}, {'author': 'Ramiro Agustin Palacios', 'rating': 5, 'text': ""Amazing rock bar, the best music I've listened in my whole life. The bartenders are friendly and Caroline is the best. They even have Fernet Branca on tap... first time I see something like that. Good beer selections and recommendations as well.\nThis place is a must if you visit the city. Keep rocking 🍺🍺"", 'time': '8 months ago'}, {'author': 'Steven Schwartz', 'rating': 4, 'text': 'A “old fashioned” punk bar but in a nice neighborhood with clean toilets. The place to  listen to the Sex Pistols with a heavily tattooed but friendly crowd.', 'time': '2 months ago'}, {'author': 'Senay Hasköy', 'rating': 4, 'text': ""I came here on the recommendation of a friend. The lady working at the bar was very polite and helpful. She was always interested when I asked for suggestions for a drink and answered my other questions about Finns without getting bored and had short conversations as well. A place I'll definitely visit again."", 'time': 'a year ago'}]"
Helsinki Bryggeri Brewhouse,"Sofiankatu 2, 00170 Helsinki, Finland",4.2,829,"[{'author': 'Jonathan Whitney', 'rating': 4, 'text': 'Good all-around spot with a cozy beer garden right off the main square. Food and drinks are a bit pricey but such is the cost of being in the upper NE of modern Europe. Only real qualm was that the wings are quite small on average and honestly all the beers tasted (and looked) the same…', 'time': 'a month ago'}, {'author': 'Sinan Akgul', 'rating': 5, 'text': 'Relaxed beer garden in the heart of the city. The outdoor seating area in the back was exactly what we were looking for after a long walk. The food was great, although it’s only the summer menu. The bartender was helpful in deciding what to take and she suggested ‘Sofia’ the specialty beer which I enjoyed drinking. I would definitely suggest a visit.', 'time': 'a month ago'}, {'author': 'JayC', 'rating': 5, 'text': 'The food and beer were very nice. A bit expensive though. We paid 80€ for two burgers, one portion of chicken wings and three beers. But still, it was tasty. And the curly fries were very crispy yum', 'time': 'a month ago'}, {'author': 'Stephen Gibson', 'rating': 5, 'text': 'A good variety of craft beers with a nice beer garden. I had the sampler paddle, lager, ipa, pils and stout for 12 euros. All were fresh and tasty. I did not try the food. If you are a beer lover, I would a recommend visit.', 'time': 'a week ago'}, {'author': 'Colin Sloan', 'rating': 5, 'text': 'Had a great lunch here which helped us refuel after a morning walking around Helsinki.  Some really nice beers on the tasting paddle.  Friendly service and a tasty burger.  Awesome location right in the centre of all attractions.', 'time': 'a month ago'}]"
Stadin Panimo,"Kaasutehtaankatu 1, 00540 Helsinki, Finland",4.5,770,"[{'author': 'Ludmila Hrižanovska', 'rating': 4, 'text': ""Lovely selection of Belgians and sometimes they have other great things on tap. It's possible to book a brewery tour and try some of their beers here too.\nI've been here a couple of times, but the most wonderful experience was surely on the Zwanze day, so next year hopefully I will be happy here again."", 'time': '3 years ago'}, {'author': 'riccardo liotta', 'rating': 5, 'text': 'Love the industrial environment.\nAnd great beers, of course', 'time': '2 months ago'}, {'author': 'Janne Jussila', 'rating': 5, 'text': 'One of the best, if not even the best taphouses i  Helsinki. Definitely worth the visit for any beer/sider lover in the area', 'time': '3 months ago'}, {'author': 'T.S.A.', 'rating': 5, 'text': 'Had a few brews in my time. These are always fantastic.', 'time': '8 months ago'}, {'author': 'Katrina Räty', 'rating': 5, 'text': 'One of my favourite beer spots in Helsinki. Cozy and great beer selection, also very good own beers. Would recommend for sure!', 'time': '8 months ago'}]"
Woolshed Helsinki,"Töölönlahdenkatu 3B, 00100 Helsinki, Finland",4.3,2868,"[{'author': 'Holly Baker', 'rating': 5, 'text': 'Great bar, with friendly bar staff! Food was delicious, and came out fast. Also had a great selection of imported Aussie beers which my husband was excited about.', 'time': 'a week ago'}, {'author': 'Mike Sapiton', 'rating': 3, 'text': 'I went for a classic burger. €21 for combo with fries and Zero coke.\n\nReally wanted to like it, since the patty is great — nice, tender structure, juicy and tasty. I think this place knows its way around meat really well. The rest was less impressive: fries were served almost cold, and the burger itself was in total semi-cold too, with tomatoes contrasting with the meat. Was not impressed by the pickles too.\n\nI also think that it has a little bit overkill amount of mayo, and so the aftertaste is a little too “fatty” to my liking.\n\nI think I would be better off ordering a steak, all things combined, but I guess if the dish was hot, 4 start would be justified. Also, great location.', 'time': 'a month ago'}, {'author': 'Gerry Gutowski', 'rating': 5, 'text': ""Worth every penny...nice happy hour deals, great TV's, Thursday pm 20% off meals."", 'time': 'a week ago'}, {'author': 'Teele', 'rating': 5, 'text': 'The price-quality ratio of a steak on a weekday (Monday-Thursday there are deals on steaks/ mains) is unbeatable in Helsinki area! The meal was super fresh and tasty, made of good quality ingredients. Warmly recommend this place 😊', 'time': '2 months ago'}, {'author': 'Sedthakorn Timsawad', 'rating': 5, 'text': 'I always enjoy their food here even lunch or dinner time. I have tried several times of steak, burgers but Korean bbq sauce is quite a little bit sweet of sauce. Will definitely come back again and again. 9.5/10 😉', 'time': '5 months ago'}]"
Treffi Pub & Bistro,"Hiihtomäentie 14, 00810 Helsinki, Finland",4.2,3005,"[{'author': 'Ralph Capper', 'rating': 4, 'text': 'Mushroom tagliatelle was a bit strange, the sauce was a thin liquid and the cheese in it set hard on the back of the spoon... not awful but also not Italian in any real way. Place itself is nice, and the staff were lovely.', 'time': 'in the last week'}, {'author': 'Fei', 'rating': 5, 'text': 'Treffi is an ideal place for workday lunch and it is always quite crowded during the lunch hours. Thanks to the big space it has, everyone can fit in. I would not say that the salad buffet, soup or dessert can compete against any other lunch places, but the main dish is usually above the average.', 'time': '3 months ago'}, {'author': 'Maria Demeter', 'rating': 5, 'text': 'The servjce is veey fast. The food very delicious. The restaurant very nice\nI recomand. 5 *', 'time': '2 weeks ago'}, {'author': 'Quyen Doan', 'rating': 4, 'text': ""The day I visited again, the waitress who made me Rose Collins it didn't taste as good as the previous time :/ My bf likes his hambuger but the lehtipihvi was such a disappointment for me. It tasted so bland and greasy, its sauce could not make it any better. I like the atmosphere and services in general."", 'time': 'a year ago'}, {'author': 'Domna Tzemi', 'rating': 4, 'text': 'Nice local restaurant in Herttoniemi. The food was good although a bit too salrty for me. It is quite expensive but at least the portions are quite large. The staff were friendly. I went on a Tuesday evening and there was pub quiz. There is also karaoke lounge downstairs.', 'time': 'a year ago'}]"
Bierhuis Rotterdam,"Tennispalatsinaukio 4, 00100 Helsinki, Finland",4.1,2276,"[{'author': 'Валерия Деордиева', 'rating': 5, 'text': ""Amazing, cozy place with enjoyable drinks and snacks. Staff is nice. Recommend if you're in Helsinki and want to spend great evening😍"", 'time': '3 months ago'}, {'author': 'Flavia Militaru', 'rating': 5, 'text': ""Possibly the best burger I've had in my life. So delicious the Crunchy bacon and we had peltolan blue as well. So so tasty!"", 'time': 'a month ago'}, {'author': 'Domna Tzemi', 'rating': 4, 'text': 'Nice pub in kamppi. It reminds me of traditional old pub. Drinks are quite expensive as you would expect. Nice terrace area in the summer sun was there until at least 8pm.', 'time': 'a year ago'}, {'author': 'Dee', 'rating': 3, 'text': 'Alright bar. Small selection of dutch beers and no traditional dutch bar snacks like bitterballen.', 'time': '3 months ago'}, {'author': 'Kostas Hahamis', 'rating': 5, 'text': 'The perfect spot to taste special beers. Kind stuff and plenty of bottled and tap beers.', 'time': '4 months ago'}]"
Beer Restaurant Hilpeä Hauki,"Vaasankatu 7, 00500 Helsinki, Finland",4.2,482,"[{'author': 'Matias Orre', 'rating': 4, 'text': 'A nice bar in a nice neighborhood in a nice city. Very nice. The bartenders are most often also have a nice way of talking to their customers.  So all in all I would rate this place as beeing a nice place to go to for a beer or two. Recommended!', 'time': 'a month ago'}, {'author': 'Domna Tzemi', 'rating': 4, 'text': 'Nice pub in Kallio. I visited this place on a Saturday night and it was not too busy. Pretty quite pub, good for having conversations or play games as there is no music. Also it is not too warm inside. The staff were friendly enough.', 'time': '2 years ago'}, {'author': 'Juuso Ilmelä', 'rating': 4, 'text': 'Great beer selection both bottles and draft with knowledgeable and friendly staff. Cozy atmosphere. Board games available.', 'time': '4 years ago'}, {'author': 'Katri Niemi', 'rating': 5, 'text': 'Relaxed bar with music at low volume. Pretty nice selection of tap beers', 'time': '6 months ago'}, {'author': 'Tiisetso', 'rating': 4, 'text': 'Lovely old school pub in Helsinki. Great selection of beers, lots of them from Finland with seemingly new beers every time I’ve visited. Friendly service where they’re always willing to recommend a good beer. There are board games available to play and is a lovely place to spend an afternoon or evening.', 'time': '5 years ago'}]"
